P r o   B r u s h -   A 2 2   P o i n t e d   C h e e k   B r u s h,http://www.anastasiabeverlyhills.com/pro-brush--a22-pointed-cheek-brush/ABH01-28622.html?cgid=holiday-2017,$ 3 0,A B H 0 1 - 2 8 6 2 2,http://www.anastasiabeverlyhills.com/dw/image/v2/BBLL_PRD/on/demandware.static/-/Sites-anastasia-master-catalog/default/dw7ce22ea0/images/products/BRUSHES/Pro Brushes/A22/A22.jpg?sw=1350&sh=1000&sm=fit,anastasiabeverlyhills
S u g a r   G l o w   K i t,http://www.anastasiabeverlyhills.com/sugar-glow-kit/ABH01-18164.html?cgid=holiday-2017,$ 4 0,A B H 0 1 - 1 8 1 6 4,http://www.anastasiabeverlyhills.com/dw/image/v2/BBLL_PRD/on/demandware.static/-/Sites-anastasia-master-catalog/default/dw55f3fa14/images/products/Holiday 2017/abh-sugar-glow-kit-a.jpg?sw=1350&sh=1000&sm=fit,anastasiabeverlyhills
B r u s h   A 2 3,http://www.anastasiabeverlyhills.com/brush-a23/ABH01-28623.html?cgid=holiday-2017,$ 2 5,A B H 0 1 - 2 8 6 2 3,http://www.anastasiabeverlyhills.com/dw/image/v2/BBLL_PRD/on/demandware.static/-/Sites-anastasia-master-catalog/default/dw5309487e/images/2017 New Logo/BRUSHES/ABH01-28623-brush-A23/2000 x 2000/abh-brush-A23.jpg?sw=1350&sh=1000&sm=fit,anastasiabeverlyhills
H o l i d a y   B l u s h   K i t s,http://www.anastasiabeverlyhills.com/holiday-blush-kits/holiday-blush-kits.html?cgid=holiday-2017,$ 3 0,h o l i d a y - b l u s h - k i t s,http://www.anastasiabeverlyhills.com/dw/image/v2/BBLL_PRD/on/demandware.static/-/Sites-anastasia-master-catalog/default/dwa7062f76/images/products/Holiday 2017/abh-blush kit-radiant-a.jpg?sw=1350&sh=1000&sm=fit,anastasiabeverlyhills
P r o   B r u s h -   A 1 9   B l u s h   B r u s h,http://www.anastasiabeverlyhills.com/pro-brush--a19-blush-brush/ABH01-28619.html?cgid=holiday-2017,$ 2 6,A B H 0 1 - 2 8 6 1 9,http://www.anastasiabeverlyhills.com/dw/image/v2/BBLL_PRD/on/demandware.static/-/Sites-anastasia-master-catalog/default/dw567f0078/images/products/BRUSHES/Pro Brushes/A19/A19.jpg?sw=1350&sh=1000&sm=fit,anastasiabeverlyhills
L i q u i d   G l o w,http://www.anastasiabeverlyhills.com/liquid-glow/liquid-glow.html?cgid=holiday-2017,$ 2 5,l i q u i d - g l o w,http://www.anastasiabeverlyhills.com/dw/image/v2/BBLL_PRD/on/demandware.static/-/Sites-anastasia-master-catalog/default/dw886d8ab9/images/products/Fall 2017/Liquid Glow/ABH01-36524-perla/2000x2000/abh-perla-liquid glow-a.jpg?sw=1350&sh=1000&sm=fit,anastasiabeverlyhills
P r o   B r u s h -   A 3 0   D o m e d   K a b u k i   B r u s h,http://www.anastasiabeverlyhills.com/pro-brush--a30-domed-kabuki-brush/ABH01-28630.html?cgid=holiday-2017,$ 2 4,A B H 0 1 - 2 8 6 3 0,http://www.anastasiabeverlyhills.com/dw/image/v2/BBLL_PRD/on/demandware.static/-/Sites-anastasia-master-catalog/default/dw2116b436/images/products/BRUSHES/Pro Brushes/A30/A30.jpg?sw=1350&sh=1000&sm=fit,anastasiabeverlyhills
D I P B R O W 速   P o m a d e,http://www.anastasiabeverlyhills.com/dipbrow-pomade-waterproof-color-brow-sculpt/dipbrow-pomade.html?cgid=holiday-2017,$ 1 8,d i p b r o w - p o m a d e,http://www.anastasiabeverlyhills.com/dw/image/v2/BBLL_PRD/on/demandware.static/-/Sites-anastasia-master-catalog/default/dw231ab3a8/images/products/BROWS/Dipbrow/Dipbrow-Medium-Brown/dipbrow-medium-brown.jpg?sw=1350&sh=1000&sm=fit,anastasiabeverlyhills
B r u s h   7 B,http://www.anastasiabeverlyhills.com/brush-7-b/ABH01-28016.html?cgid=holiday-2017,$ 1 8,A B H 0 1 - 2 8 0 1 6,http://www.anastasiabeverlyhills.com/dw/image/v2/BBLL_PRD/on/demandware.static/-/Sites-anastasia-master-catalog/default/dw8713b348/images/2017 New Logo/BRUSHES/ABH01-28016-brush-7B/2000 x 2000/abh-brush-7B.jpg?sw=1350&sh=1000&sm=fit,anastasiabeverlyhills
T i n t e d   B r o w   G e l,http://www.anastasiabeverlyhills.com/tinted-brow-gel/tinted-brow-gel.html?cgid=holiday-2017,$ 2 2,t i n t e d - b r o w - g e l,http://www.anastasiabeverlyhills.com/dw/image/v2/BBLL_PRD/on/demandware.static/-/Sites-anastasia-master-catalog/default/dw8e25ed1a/images/2017 New Logo/BROWS/Tinted Brow Gel/ABH01-01006-granite/2000 x 2000/abh-granite-tinted-brow-gel-open.jpg?sw=1350&sh=1000&sm=fit,anastasiabeverlyhills
L i q u i d   L i p s t i c k   -   3 p c   S e t   M i n i,http://www.anastasiabeverlyhills.com/liquid-lipstick---3pc-set-mini/ABH01-32198.html?cgid=holiday-2017,$ 2 5,A B H 0 1 - 3 2 1 9 8,http://www.anastasiabeverlyhills.com/dw/image/v2/BBLL_PRD/on/demandware.static/-/Sites-anastasia-master-catalog/default/dw4be498a2/images/products/Holiday 2017/abh-mini liquid lipstick set-a_rev.jpg?sw=1350&sh=1000&sm=fit,anastasiabeverlyhills
B r o w   P r o   P a l e t t e,http://www.anastasiabeverlyhills.com/brow-pro-palette/ABH01-84012.html?cgid=holiday-2017,$ 8 8,A B H 0 1 - 8 4 0 1 2,http://www.anastasiabeverlyhills.com/dw/image/v2/BBLL_PRD/on/demandware.static/-/Sites-anastasia-master-catalog/default/dw453ab03b/images/2017 New Logo/BROWS/Brow Pro Palette/ABH01-84012-brow-pro-palette/abh-brow-pro-palette.jpg?sw=1350&sh=1000&sm=fit,anastasiabeverlyhills
S t i c k   F o u n d a t i o n,http://www.anastasiabeverlyhills.com/stick-foundation/stick-foundation.html?cgid=holiday-2017,$ 2 5,s t i c k - f o u n d a t i o n,http://www.anastasiabeverlyhills.com/dw/image/v2/BBLL_PRD/on/demandware.static/-/Sites-anastasia-master-catalog/default/dw355714b3/images/products/FACE/Stick Foundation/CAP OFF/Stick Foundation Cap OFF_0014_warm natural.jpg?sw=1350&sh=1000&sm=fit,anastasiabeverlyhills
C o n c e a l e r,http://www.anastasiabeverlyhills.com/concealer-full-coverage-mask-correct/concealer.html?cgid=holiday-2017,$ 2 0,c o n c e a l e r,http://www.anastasiabeverlyhills.com/dw/image/v2/BBLL_PRD/on/demandware.static/-/Sites-anastasia-master-catalog/default/dw1e83a709/images/products/FACE/Concealers/ABH01-13041 concealer 1.5/1.5-concealer-jar.jpg?sw=1350&sh=1000&sm=fit,anastasiabeverlyhills
P r o   B r u s h -   A 2   P r e c i s e   C o n c e a l e r   B r u s h,http://www.anastasiabeverlyhills.com/pro-brush--a2-precise-concealer-brush/ABH01-28602.html?cgid=holiday-2017,$ 1 8,A B H 0 1 - 2 8 6 0 2,http://www.anastasiabeverlyhills.com/dw/image/v2/BBLL_PRD/on/demandware.static/-/Sites-anastasia-master-catalog/default/dwfe7111eb/images/products/BRUSHES/Pro Brushes/A2/A2.jpg?sw=1350&sh=1000&sm=fit,anastasiabeverlyhills
M o o n c h i l d   G l o w   K i t,http://www.anastasiabeverlyhills.com/glow-kit-moonchild/ABH01-18159.html?cgid=holiday-2017,$ 4 0,A B H 0 1 - 1 8 1 5 9,http://www.anastasiabeverlyhills.com/dw/image/v2/BBLL_PRD/on/demandware.static/-/Sites-anastasia-master-catalog/default/dweb7a9b2a/images/products/FACE/Glow Kits/Moonchild/glow-kit-moonchild.jpg?sw=1350&sh=1000&sm=fit,anastasiabeverlyhills
B r o w   W i z 速,http://www.anastasiabeverlyhills.com/brow-wiz/brow-wiz.html?cgid=holiday-2017,$ 2 1,b r o w - w i z,http://www.anastasiabeverlyhills.com/dw/image/v2/BBLL_PRD/on/demandware.static/-/Sites-anastasia-master-catalog/default/dw5ff96acd/images/2017 New Logo/BROWS/Brow Wiz/ABH01-86003-dark-brown/2000 x 2000/abh-dark-brown-brow-wiz.jpg?sw=1350&sh=1000&sm=fit,anastasiabeverlyhills
B r o w   D e f i n e r,http://www.anastasiabeverlyhills.com/brow-definer/brow-definer.html?cgid=holiday-2017,$ 2 3,b r o w - d e f i n e r,http://www.anastasiabeverlyhills.com/dw/image/v2/BBLL_PRD/on/demandware.static/-/Sites-anastasia-master-catalog/default/dwed7fbacb/images/2017 New Logo/BROWS/Brow Definer/ABH01-04409-dark-brown/2000 x 2000/abh-dark-brown-brow-definer.jpg?sw=1350&sh=1000&sm=fit,anastasiabeverlyhills
C l e a r   B r o w   G e l,http://www.anastasiabeverlyhills.com/clear-brow-gel/ABH01-01001.html?cgid=holiday-2017,$ 2 2,A B H 0 1 - 0 1 0 0 1,http://www.anastasiabeverlyhills.com/dw/image/v2/BBLL_PRD/on/demandware.static/-/Sites-anastasia-master-catalog/default/dw28fbb6f0/images/2017 New Logo/BROWS/Clear Brow Gel/ABH01-01001-clear-brow-gel/2000 x 2000/abh-clear-brow-gel-on.jpg?sw=1350&sh=1000&sm=fit,anastasiabeverlyhills
C o n t o u r   C r e a m   K i t,http://www.anastasiabeverlyhills.com/contour-cream-kit/contour-cream-kit.html?cgid=holiday-2017,$ 4 0,c o n t o u r - c r e a m - k i t,http://www.anastasiabeverlyhills.com/dw/image/v2/BBLL_PRD/on/demandware.static/-/Sites-anastasia-master-catalog/default/dw55900d7e/images/2017 New Logo/FACE/Contour Cream Kits/ABH01-18707-medium-contour-cream-kit/2000 x 2000/abh-medium-contour-cream-kit.jpg?sw=1350&sh=1000&sm=fit,anastasiabeverlyhills
P r o   B r u s h -   A 1 8   A n g l e   C h i s e l e r   B r u s h,http://www.anastasiabeverlyhills.com/pro-brush--a18-angle-chiseler-brush/ABH01-28618.html?cgid=holiday-2017,$ 3 0,A B H 0 1 - 2 8 6 1 8,http://www.anastasiabeverlyhills.com/dw/image/v2/BBLL_PRD/on/demandware.static/-/Sites-anastasia-master-catalog/default/dwf21a44f7/images/products/BRUSHES/Pro Brushes/A18/A18.jpg?sw=1350&sh=1000&sm=fit,anastasiabeverlyhills
P r o   B r u s h -   A 7   L a r g e   B l e n d i n g   B r u s h,http://www.anastasiabeverlyhills.com/pro-brush--a7-large-blending-brush/ABH01-28607.html?cgid=holiday-2017,$ 2 3,A B H 0 1 - 2 8 6 0 7,http://www.anastasiabeverlyhills.com/dw/image/v2/BBLL_PRD/on/demandware.static/-/Sites-anastasia-master-catalog/default/dw12d28aa7/images/products/BRUSHES/Pro Brushes/A7/A7.jpg?sw=1350&sh=1000&sm=fit,anastasiabeverlyhills
L i p   G l o s s,http://www.anastasiabeverlyhills.com/lip-gloss/lip-gloss.html?cgid=holiday-2017,$ 1 6,l i p - g l o s s,http://www.anastasiabeverlyhills.com/dw/image/v2/BBLL_PRD/on/demandware.static/-/Sites-anastasia-master-catalog/default/dwbc3ea1c1/images/2017 New Logo/LIPS/Lip Gloss/ABH01-29115-toffee/abh-toffee-lip-gloss-off.png?sw=1350&sh=1000&sm=fit,anastasiabeverlyhills
A u r o r a   G l o w   K i t,http://www.anastasiabeverlyhills.com/glow-kit-aurora/ABH01-18163.html?cgid=holiday-2017,$ 4 0,A B H 0 1 - 1 8 1 6 3,http://www.anastasiabeverlyhills.com/dw/image/v2/BBLL_PRD/on/demandware.static/-/Sites-anastasia-master-catalog/default/dwa7281d35/images/products/FACE/Glow Kits/Aurora/abh-aurora-glow-kit.png?sw=1350&sh=1000&sm=fit,anastasiabeverlyhills
P r o   B r u s h -   A 1 0   D i f f u s e r   B r u s h,http://www.anastasiabeverlyhills.com/pro-brush--a10-diffuser-brush/ABH01-28610.html?cgid=holiday-2017,$ 2 1,A B H 0 1 - 2 8 6 1 0,http://www.anastasiabeverlyhills.com/dw/image/v2/BBLL_PRD/on/demandware.static/-/Sites-anastasia-master-catalog/default/dw8e602688/images/products/BRUSHES/Pro Brushes/A10/A10.jpg?sw=1350&sh=1000&sm=fit,anastasiabeverlyhills
B r o w   P o w d e r   D u o,http://www.anastasiabeverlyhills.com/brow-powder-duo/abh-brow-powder-duo.html?cgid=holiday-2017,$ 2 3,a b h - b r o w - p o w d e r - d u o,http://www.anastasiabeverlyhills.com/dw/image/v2/BBLL_PRD/on/demandware.static/-/Sites-anastasia-master-catalog/default/dw453555d4/images/products/BROWS/Brow Powder Duo/ABH01-56004 Dark Brown/brow-powder-duo-dark-brown.jpg?sw=1350&sh=1000&sm=fit,anastasiabeverlyhills
D u o   B r u s h   #   2 0,http://www.anastasiabeverlyhills.com/brow-brush-20-brows-stright-cut/ABH01-28024.html?cgid=holiday-2017,$ 1 8,A B H 0 1 - 2 8 0 2 4,http://www.anastasiabeverlyhills.com/dw/image/v2/BBLL_PRD/on/demandware.static/-/Sites-anastasia-master-catalog/default/dw1c3ba1de/images/2017 New Logo/BRUSHES/ABH01-28024-brush-20/2000 x 2000/abh-brush-20.jpg?sw=1350&sh=1000&sm=fit,anastasiabeverlyhills
S t e n c i l s,http://www.anastasiabeverlyhills.com/stencils/ABH01-11005.html?cgid=holiday-2017,$ 2 0,A B H 0 1 - 1 1 0 0 5,http://www.anastasiabeverlyhills.com/dw/image/v2/BBLL_PRD/on/demandware.static/-/Sites-anastasia-master-catalog/default/dw0ac2200e/images/products/BROWS/Stencils/ABH01-11005 Stencils/stencils.jpg?sw=1350&sh=1000&sm=fit,anastasiabeverlyhills
P r e c i s i o n   T w e e z e r s,http://www.anastasiabeverlyhills.com/precision-tweezers/ABH01-09002.html?cgid=holiday-2017,$ 2 8,A B H 0 1 - 0 9 0 0 2,http://www.anastasiabeverlyhills.com/dw/image/v2/BBLL_PRD/on/demandware.static/-/Sites-anastasia-master-catalog/default/dwa67c6ae6/images/2017 New Logo/BROWS/Tweezers/abh-tweezers.jpg?sw=1350&sh=1000&sm=fit,anastasiabeverlyhills
P r o   B r u s h -   A 1 4   P e n c i l   B r u s h,http://www.anastasiabeverlyhills.com/pro-brush--a14-pencil-brush/ABH01-28614.html?cgid=holiday-2017,$ 1 8,A B H 0 1 - 2 8 6 1 4,http://www.anastasiabeverlyhills.com/dw/image/v2/BBLL_PRD/on/demandware.static/-/Sites-anastasia-master-catalog/default/dw55e970ca/images/products/BRUSHES/Pro Brushes/A14/A14.jpg?sw=1350&sh=1000&sm=fit,anastasiabeverlyhills
D a r k s i d e   W a t e r p r o o f   G e l   L i n e r,http://www.anastasiabeverlyhills.com/waterproof-gel-liner/waterproof-gel-liner.html?cgid=holiday-2017,$ 1 8,A B H 0 1 - 2 1 4 2 1,http://www.anastasiabeverlyhills.com/dw/image/v2/BBLL_PRD/on/demandware.static/-/Sites-anastasia-master-catalog/default/dw735271a1/images/2017 New Logo/EYES/Darkside Waterproof Gel Liner/ABH01-21421-darkside-waterproof-gel-liner/2000 x 2000/abh-darkside-waterproof-gel-liner.jpg?sw=1350&sh=1000&sm=fit,anastasiabeverlyhills
P r o   B r u s h -   A 2 8   P r e c i s e   E y e l i n e r   B r u s h,http://www.anastasiabeverlyhills.com/pro-brush--a28-precise-eyeliner-brush/ABH01-28628.html?cgid=holiday-2017,$ 1 6,A B H 0 1 - 2 8 6 2 8,http://www.anastasiabeverlyhills.com/dw/image/v2/BBLL_PRD/on/demandware.static/-/Sites-anastasia-master-catalog/default/dwb95d7bd2/images/products/BRUSHES/Pro Brushes/A28/A28.jpg?sw=1350&sh=1000&sm=fit,anastasiabeverlyhills
S w i s h   L i n e r   B r u s h,http://www.anastasiabeverlyhills.com/swish-liner-brush/ABH01-28130.html?cgid=holiday-2017,$ 1 8,A B H 0 1 - 2 8 1 3 0,http://www.anastasiabeverlyhills.com/dw/image/v2/BBLL_PRD/on/demandware.static/-/Sites-anastasia-master-catalog/default/dw2a1766fd/images/products/BRUSHES/Pro Brushes/Swish/Swish.jpg?sw=1350&sh=1000&sm=fit,anastasiabeverlyhills
D u o   B r u s h   #   1 2,http://www.anastasiabeverlyhills.com/brush-12/ABH01-28033.html?cgid=holiday-2017,$ 1 8,A B H 0 1 - 2 8 0 3 3,http://www.anastasiabeverlyhills.com/dw/image/v2/BBLL_PRD/on/demandware.static/-/Sites-anastasia-master-catalog/default/dwedae0237/images/2017 New Logo/BRUSHES/ABH01-28033-brush-12/2000 x 2000/abh-brush-12.jpg?sw=1350&sh=1000&sm=fit,anastasiabeverlyhills
P r o   B r u s h -   A 2 5   T a p e r e d   B l e n d i n g   B r u s h,http://www.anastasiabeverlyhills.com/pro-brush--a25-tapered-blending-brush/ABH01-28625.html?cgid=holiday-2017,$ 2 3,A B H 0 1 - 2 8 6 2 5,http://www.anastasiabeverlyhills.com/dw/image/v2/BBLL_PRD/on/demandware.static/-/Sites-anastasia-master-catalog/default/dw7104f568/images/products/BRUSHES/Pro Brushes/A25/A25.jpg?sw=1350&sh=1000&sm=fit,anastasiabeverlyhills
P r o   B r u s h -   A 2 4   M e d i u m   S h a d o w   B r u s h,http://www.anastasiabeverlyhills.com/pro-brush--a24-medium-shadow-brush/ABH01-28624.html?cgid=holiday-2017,$ 2 3,A B H 0 1 - 2 8 6 2 4,http://www.anastasiabeverlyhills.com/dw/image/v2/BBLL_PRD/on/demandware.static/-/Sites-anastasia-master-catalog/default/dw46a3aee4/images/products/BRUSHES/Pro Brushes/A24/A24.jpg?sw=1350&sh=1000&sm=fit,anastasiabeverlyhills
P r o   B r u s h -   A 1 2   S m a l l   C o n t o u r   B r u s h,http://www.anastasiabeverlyhills.com/pro-brush--a12-small-contour-brush/ABH01-28612.html?cgid=holiday-2017,$ 2 0,A B H 0 1 - 2 8 6 1 2,http://www.anastasiabeverlyhills.com/dw/image/v2/BBLL_PRD/on/demandware.static/-/Sites-anastasia-master-catalog/default/dw49839f96/images/products/BRUSHES/Pro Brushes/A12/A12.jpg?sw=1350&sh=1000&sm=fit,anastasiabeverlyhills
P r o   B r u s h -   A 2 0   L a r g e   P o w d e r   B r u s h,http://www.anastasiabeverlyhills.com/pro-brush--a20-large-powder-brush/ABH01-28620.html?cgid=holiday-2017,$ 3 5,A B H 0 1 - 2 8 6 2 0,http://www.anastasiabeverlyhills.com/dw/image/v2/BBLL_PRD/on/demandware.static/-/Sites-anastasia-master-catalog/default/dw8fe1fd4f/images/products/BRUSHES/Pro Brushes/A20/A20.jpg?sw=1350&sh=1000&sm=fit,anastasiabeverlyhills
P r o   B r u s h -   A 2 6   C r e a s e   B l e n d i n g   B r u s h,http://www.anastasiabeverlyhills.com/pro-brush--a26-crease-blending-brush/ABH01-28626.html?cgid=holiday-2017,$ 2 2,A B H 0 1 - 2 8 6 2 6,http://www.anastasiabeverlyhills.com/dw/image/v2/BBLL_PRD/on/demandware.static/-/Sites-anastasia-master-catalog/default/dwb00c1d30/images/products/BRUSHES/Pro Brushes/A26/A26.jpg?sw=1350&sh=1000&sm=fit,anastasiabeverlyhills
S h a r p e n e r,http://www.anastasiabeverlyhills.com/sharpener/ABH01-12001.html?cgid=holiday-2017,$ 6,A B H 0 1 - 1 2 0 0 1,http://www.anastasiabeverlyhills.com/dw/image/v2/BBLL_PRD/on/demandware.static/-/Sites-anastasia-master-catalog/default/dw2dc3afd7/images/products/BROWS/Sharpener/ABH01-12001 sharpener/sharpener.jpg?sw=1350&sh=1000&sm=fit,anastasiabeverlyhills
L i p   P r i m e r,http://www.anastasiabeverlyhills.com/lip-primer/ABH01-32191.html?cgid=holiday-2017,$ 1 6,A B H 0 1 - 3 2 1 9 1,http://www.anastasiabeverlyhills.com/dw/image/v2/BBLL_PRD/on/demandware.static/-/Sites-anastasia-master-catalog/default/dw05c424ae/images/2017 New Logo/LIPS/Lip Primer/ABH01-32191-lip-primer/2000 x 2000/abh-lip-primer.jpg?sw=1350&sh=1000&sm=fit,anastasiabeverlyhills
S c i s s o r s,http://www.anastasiabeverlyhills.com/scissors/ABH01-10002.html?cgid=holiday-2017,$ 2 2 . 5 0,A B H 0 1 - 1 0 0 0 2,http://www.anastasiabeverlyhills.com/dw/image/v2/BBLL_PRD/on/demandware.static/-/Sites-anastasia-master-catalog/default/dw3fff0d25/images/products/BROWS/Scissors/ABH01-10002 scissors/scissors.jpg?sw=1350&sh=1000&sm=fit,anastasiabeverlyhills
M a t t e   L i p s t i c k,http://www.anastasiabeverlyhills.com/matte-lipstick/matte-lipstick.html?cgid=holiday-2017,$ 1 8,m a t t e - l i p s t i c k,http://www.anastasiabeverlyhills.com/dw/image/v2/BBLL_PRD/on/demandware.static/-/Sites-anastasia-master-catalog/default/dw89e34cce/images/products/Fall 2017/Matte Lipstick/ABH01-33001-dusty-mauve/2000x2000/abh-matte-lipstick-dusty mauve-a.jpg?sw=1350&sh=1000&sm=fit,anastasiabeverlyhills
P r o   B r u s h -   A 2 2   P o i n t e d   C h e e k   B r u s h,http://www.anastasiabeverlyhills.com/pro-brush--a22-pointed-cheek-brush/ABH01-28622.html?cgid=holiday-2017,$ 3 0,A B H 0 1 - 2 8 6 2 2,http://www.anastasiabeverlyhills.com/dw/image/v2/BBLL_PRD/on/demandware.static/-/Sites-anastasia-master-catalog/default/dw7ce22ea0/images/products/BRUSHES/Pro Brushes/A22/A22.jpg?sw=1350&sh=1000&sm=fit,anastasiabeverlyhills
S u g a r   G l o w   K i t,http://www.anastasiabeverlyhills.com/sugar-glow-kit/ABH01-18164.html?cgid=holiday-2017,$ 4 0,A B H 0 1 - 1 8 1 6 4,http://www.anastasiabeverlyhills.com/dw/image/v2/BBLL_PRD/on/demandware.static/-/Sites-anastasia-master-catalog/default/dw55f3fa14/images/products/Holiday 2017/abh-sugar-glow-kit-a.jpg?sw=1350&sh=1000&sm=fit,anastasiabeverlyhills
B r u s h   A 2 3,http://www.anastasiabeverlyhills.com/brush-a23/ABH01-28623.html?cgid=holiday-2017,$ 2 5,A B H 0 1 - 2 8 6 2 3,http://www.anastasiabeverlyhills.com/dw/image/v2/BBLL_PRD/on/demandware.static/-/Sites-anastasia-master-catalog/default/dw5309487e/images/2017 New Logo/BRUSHES/ABH01-28623-brush-A23/2000 x 2000/abh-brush-A23.jpg?sw=1350&sh=1000&sm=fit,anastasiabeverlyhills
H o l i d a y   B l u s h   K i t s,http://www.anastasiabeverlyhills.com/holiday-blush-kits/holiday-blush-kits.html?cgid=holiday-2017,$ 3 0,h o l i d a y - b l u s h - k i t s,http://www.anastasiabeverlyhills.com/dw/image/v2/BBLL_PRD/on/demandware.static/-/Sites-anastasia-master-catalog/default/dwa7062f76/images/products/Holiday 2017/abh-blush kit-radiant-a.jpg?sw=1350&sh=1000&sm=fit,anastasiabeverlyhills
P r o   B r u s h -   A 1 9   B l u s h   B r u s h,http://www.anastasiabeverlyhills.com/pro-brush--a19-blush-brush/ABH01-28619.html?cgid=holiday-2017,$ 2 6,A B H 0 1 - 2 8 6 1 9,http://www.anastasiabeverlyhills.com/dw/image/v2/BBLL_PRD/on/demandware.static/-/Sites-anastasia-master-catalog/default/dw567f0078/images/products/BRUSHES/Pro Brushes/A19/A19.jpg?sw=1350&sh=1000&sm=fit,anastasiabeverlyhills
L i q u i d   G l o w,http://www.anastasiabeverlyhills.com/liquid-glow/liquid-glow.html?cgid=holiday-2017,$ 2 5,l i q u i d - g l o w,http://www.anastasiabeverlyhills.com/dw/image/v2/BBLL_PRD/on/demandware.static/-/Sites-anastasia-master-catalog/default/dw886d8ab9/images/products/Fall 2017/Liquid Glow/ABH01-36524-perla/2000x2000/abh-perla-liquid glow-a.jpg?sw=1350&sh=1000&sm=fit,anastasiabeverlyhills
P r o   B r u s h -   A 3 0   D o m e d   K a b u k i   B r u s h,http://www.anastasiabeverlyhills.com/pro-brush--a30-domed-kabuki-brush/ABH01-28630.html?cgid=holiday-2017,$ 2 4,A B H 0 1 - 2 8 6 3 0,http://www.anastasiabeverlyhills.com/dw/image/v2/BBLL_PRD/on/demandware.static/-/Sites-anastasia-master-catalog/default/dw2116b436/images/products/BRUSHES/Pro Brushes/A30/A30.jpg?sw=1350&sh=1000&sm=fit,anastasiabeverlyhills
D I P B R O W 速   P o m a d e,http://www.anastasiabeverlyhills.com/dipbrow-pomade-waterproof-color-brow-sculpt/dipbrow-pomade.html?cgid=holiday-2017,$ 1 8,d i p b r o w - p o m a d e,http://www.anastasiabeverlyhills.com/dw/image/v2/BBLL_PRD/on/demandware.static/-/Sites-anastasia-master-catalog/default/dw231ab3a8/images/products/BROWS/Dipbrow/Dipbrow-Medium-Brown/dipbrow-medium-brown.jpg?sw=1350&sh=1000&sm=fit,anastasiabeverlyhills
B r u s h   7 B,http://www.anastasiabeverlyhills.com/brush-7-b/ABH01-28016.html?cgid=holiday-2017,$ 1 8,A B H 0 1 - 2 8 0 1 6,http://www.anastasiabeverlyhills.com/dw/image/v2/BBLL_PRD/on/demandware.static/-/Sites-anastasia-master-catalog/default/dw8713b348/images/2017 New Logo/BRUSHES/ABH01-28016-brush-7B/2000 x 2000/abh-brush-7B.jpg?sw=1350&sh=1000&sm=fit,anastasiabeverlyhills
T i n t e d   B r o w   G e l,http://www.anastasiabeverlyhills.com/tinted-brow-gel/tinted-brow-gel.html?cgid=holiday-2017,$ 2 2,t i n t e d - b r o w - g e l,http://www.anastasiabeverlyhills.com/dw/image/v2/BBLL_PRD/on/demandware.static/-/Sites-anastasia-master-catalog/default/dw8e25ed1a/images/2017 New Logo/BROWS/Tinted Brow Gel/ABH01-01006-granite/2000 x 2000/abh-granite-tinted-brow-gel-open.jpg?sw=1350&sh=1000&sm=fit,anastasiabeverlyhills
L i q u i d   L i p s t i c k   -   3 p c   S e t   M i n i,http://www.anastasiabeverlyhills.com/liquid-lipstick---3pc-set-mini/ABH01-32198.html?cgid=holiday-2017,$ 2 5,A B H 0 1 - 3 2 1 9 8,http://www.anastasiabeverlyhills.com/dw/image/v2/BBLL_PRD/on/demandware.static/-/Sites-anastasia-master-catalog/default/dw4be498a2/images/products/Holiday 2017/abh-mini liquid lipstick set-a_rev.jpg?sw=1350&sh=1000&sm=fit,anastasiabeverlyhills
B r o w   P r o   P a l e t t e,http://www.anastasiabeverlyhills.com/brow-pro-palette/ABH01-84012.html?cgid=holiday-2017,$ 8 8,A B H 0 1 - 8 4 0 1 2,http://www.anastasiabeverlyhills.com/dw/image/v2/BBLL_PRD/on/demandware.static/-/Sites-anastasia-master-catalog/default/dw453ab03b/images/2017 New Logo/BROWS/Brow Pro Palette/ABH01-84012-brow-pro-palette/abh-brow-pro-palette.jpg?sw=1350&sh=1000&sm=fit,anastasiabeverlyhills
S t i c k   F o u n d a t i o n,http://www.anastasiabeverlyhills.com/stick-foundation/stick-foundation.html?cgid=holiday-2017,$ 2 5,s t i c k - f o u n d a t i o n,http://www.anastasiabeverlyhills.com/dw/image/v2/BBLL_PRD/on/demandware.static/-/Sites-anastasia-master-catalog/default/dw355714b3/images/products/FACE/Stick Foundation/CAP OFF/Stick Foundation Cap OFF_0014_warm natural.jpg?sw=1350&sh=1000&sm=fit,anastasiabeverlyhills
C o n c e a l e r,http://www.anastasiabeverlyhills.com/concealer-full-coverage-mask-correct/concealer.html?cgid=holiday-2017,$ 2 0,c o n c e a l e r,http://www.anastasiabeverlyhills.com/dw/image/v2/BBLL_PRD/on/demandware.static/-/Sites-anastasia-master-catalog/default/dw1e83a709/images/products/FACE/Concealers/ABH01-13041 concealer 1.5/1.5-concealer-jar.jpg?sw=1350&sh=1000&sm=fit,anastasiabeverlyhills
P r o   B r u s h -   A 2   P r e c i s e   C o n c e a l e r   B r u s h,http://www.anastasiabeverlyhills.com/pro-brush--a2-precise-concealer-brush/ABH01-28602.html?cgid=holiday-2017,$ 1 8,A B H 0 1 - 2 8 6 0 2,http://www.anastasiabeverlyhills.com/dw/image/v2/BBLL_PRD/on/demandware.static/-/Sites-anastasia-master-catalog/default/dwfe7111eb/images/products/BRUSHES/Pro Brushes/A2/A2.jpg?sw=1350&sh=1000&sm=fit,anastasiabeverlyhills
M o o n c h i l d   G l o w   K i t,http://www.anastasiabeverlyhills.com/glow-kit-moonchild/ABH01-18159.html?cgid=holiday-2017,$ 4 0,A B H 0 1 - 1 8 1 5 9,http://www.anastasiabeverlyhills.com/dw/image/v2/BBLL_PRD/on/demandware.static/-/Sites-anastasia-master-catalog/default/dweb7a9b2a/images/products/FACE/Glow Kits/Moonchild/glow-kit-moonchild.jpg?sw=1350&sh=1000&sm=fit,anastasiabeverlyhills
B r o w   W i z 速,http://www.anastasiabeverlyhills.com/brow-wiz/brow-wiz.html?cgid=holiday-2017,$ 2 1,b r o w - w i z,http://www.anastasiabeverlyhills.com/dw/image/v2/BBLL_PRD/on/demandware.static/-/Sites-anastasia-master-catalog/default/dw5ff96acd/images/2017 New Logo/BROWS/Brow Wiz/ABH01-86003-dark-brown/2000 x 2000/abh-dark-brown-brow-wiz.jpg?sw=1350&sh=1000&sm=fit,anastasiabeverlyhills
B r o w   D e f i n e r,http://www.anastasiabeverlyhills.com/brow-definer/brow-definer.html?cgid=holiday-2017,$ 2 3,b r o w - d e f i n e r,http://www.anastasiabeverlyhills.com/dw/image/v2/BBLL_PRD/on/demandware.static/-/Sites-anastasia-master-catalog/default/dwed7fbacb/images/2017 New Logo/BROWS/Brow Definer/ABH01-04409-dark-brown/2000 x 2000/abh-dark-brown-brow-definer.jpg?sw=1350&sh=1000&sm=fit,anastasiabeverlyhills
C l e a r   B r o w   G e l,http://www.anastasiabeverlyhills.com/clear-brow-gel/ABH01-01001.html?cgid=holiday-2017,$ 2 2,A B H 0 1 - 0 1 0 0 1,http://www.anastasiabeverlyhills.com/dw/image/v2/BBLL_PRD/on/demandware.static/-/Sites-anastasia-master-catalog/default/dw28fbb6f0/images/2017 New Logo/BROWS/Clear Brow Gel/ABH01-01001-clear-brow-gel/2000 x 2000/abh-clear-brow-gel-on.jpg?sw=1350&sh=1000&sm=fit,anastasiabeverlyhills
